project_slug,period,response_type,topic,rating_1_to_5,note
civic-data-commons,2026-Q2,maintainer,triage_capacity,3,"Volunteer triage helps, but old issues need a focused cleanup."
civic-data-commons,2026-Q2,maintainer,release_confidence,4,"Release process is understood by core maintainers but not documented well enough for new maintainers."
civic-data-commons,2026-Q2,contributor,onboarding_clarity,4,"Quickstart is useful; architecture guide helped with a dataset adapter."
learning-lab-toolkit,2026-Q2,maintainer,triage_capacity,2,"Two maintainers can handle normal weeks, but curriculum season creates delays."
learning-lab-toolkit,2026-Q2,maintainer,release_confidence,3,"Lesson fixes are straightforward; translation and pilot feedback need stronger criteria."
learning-lab-toolkit,2026-Q2,contributor,onboarding_clarity,4,"Non-code contribution options were easy to understand."
